SQL> create table customer(id number(30) primary key,name varchar(50),address varchar(50),city varchar(50),country varchar(50),age varchar(50),salary number(30));

Table created.

SQL> insert into customer values(&id,'&name','&address','&city','&country','&age',&salary);
Enter value for id: 1
Enter value for name: priya
Enter value for address: red valley
Enter value for city: texas
Enter value for country: NW
Enter value for age: 29
Enter value for salary: 19500
old   1: insert into customer values(&id,'&name','&address','&city','&country','&age',&salary)
new   1: insert into customer values(1,'priya','red valley','texas','NW','29',19500)

1 row created.

SQL> /
Enter value for id: 2
Enter value for name: devika
Enter value for address: villa house
Enter value for city: nalik
Enter value for country: mexico
Enter value for age: 35
Enter value for salary: 17000
old   1: insert into customer values(&id,'&name','&address','&city','&country','&age',&salary)
new   1: insert into customer values(2,'devika','villa house','nalik','mexico','35',17000)

1 row created.

SQL> /
Enter value for id: 3
Enter value for name: vikram desayi
Enter value for address: desayi house
Enter value for city: TVM
Enter value for country: india
Enter value for age: 45
Enter value for salary: 17500
old   1: insert into customer values(&id,'&name','&address','&city','&country','&age',&salary)
new   1: insert into customer values(3,'vikram desayi','desayi house','TVM','india','45',17500)

1 row created.

SQL> /
Enter value for id: 4
Enter value for name: sandra
Enter value for address: v i bhavan
Enter value for city: TVM
Enter value for country: india
Enter value for age: 22
Enter value for salary: 20500
old   1: insert into customer values(&id,'&name','&address','&city','&country','&age',&salary)
new   1: insert into customer values(4,'sandra ','v i bhavan','TVM','india','22',20500)

1 row created.

SQL> /
Enter value for id: 5
Enter value for name: lavanya
Enter value for address: sandram
Enter value for city: TVM
Enter value for country: india
Enter value for age: 26
Enter value for salary: 35600
old   1: insert into customer values(&id,'&name','&address','&city','&country','&age',&salary)
new   1: insert into customer values(5,'lavanya','sandram','TVM','india','26',35600)

1 row created.

SQL> select * from customer where name like 'p%';

        ID NAME
---------- --------------------------------------------------
ADDRESS
--------------------------------------------------
CITY
--------------------------------------------------
COUNTRY
--------------------------------------------------
AGE                                                    SALARY
-------------------------------------------------- ----------
         1 priya
red valley
texas

        ID NAME
---------- --------------------------------------------------
ADDRESS
--------------------------------------------------
CITY
--------------------------------------------------
COUNTRY
--------------------------------------------------
AGE                                                    SALARY
-------------------------------------------------- ----------
NW
29                                                      19500


SQL> select * from customer where name like '%ya%';

        ID NAME
---------- --------------------------------------------------
ADDRESS
--------------------------------------------------
CITY
--------------------------------------------------
COUNTRY
--------------------------------------------------
AGE                                                    SALARY
-------------------------------------------------- ----------
         1 priya
red valley
texas

        ID NAME
---------- --------------------------------------------------
ADDRESS
--------------------------------------------------
CITY
--------------------------------------------------
COUNTRY
--------------------------------------------------
AGE                                                    SALARY
-------------------------------------------------- ----------
NW
29                                                      19500


        ID NAME
---------- --------------------------------------------------
ADDRESS
--------------------------------------------------
CITY
--------------------------------------------------
COUNTRY
--------------------------------------------------
AGE                                                    SALARY
-------------------------------------------------- ----------
         5 lavanya
sandram
TVM

        ID NAME
---------- --------------------------------------------------
ADDRESS
--------------------------------------------------
CITY
--------------------------------------------------
COUNTRY
--------------------------------------------------
AGE                                                    SALARY
-------------------------------------------------- ----------
india
26                                                      35600


SQL> update customer set city='melvi' where  id='3';

1 row updated.

SQL> select * from customer where city like '%i';

        ID NAME
---------- --------------------------------------------------
ADDRESS
--------------------------------------------------
CITY
--------------------------------------------------
COUNTRY
--------------------------------------------------
AGE                                                    SALARY
-------------------------------------------------- ----------
         3 vikram desayi
desayi house
melvi

        ID NAME
---------- --------------------------------------------------
ADDRESS
--------------------------------------------------
CITY
--------------------------------------------------
COUNTRY
--------------------------------------------------
AGE                                                    SALARY
-------------------------------------------------- ----------
india
45                                                      17500


SQL> select * from customer where age like '2%';

        ID NAME
---------- --------------------------------------------------
ADDRESS
--------------------------------------------------
CITY
--------------------------------------------------
COUNTRY
--------------------------------------------------
AGE                                                    SALARY
-------------------------------------------------- ----------
         1 priya
red valley
texas

        ID NAME
---------- --------------------------------------------------
ADDRESS
--------------------------------------------------
CITY
--------------------------------------------------
COUNTRY
--------------------------------------------------
AGE                                                    SALARY
-------------------------------------------------- ----------
NW
29                                                      19500


        ID NAME
---------- --------------------------------------------------
ADDRESS
--------------------------------------------------
CITY
--------------------------------------------------
COUNTRY
--------------------------------------------------
AGE                                                    SALARY
-------------------------------------------------- ----------
         4 sandra
v i bhavan
TVM

        ID NAME
---------- --------------------------------------------------
ADDRESS
--------------------------------------------------
CITY
--------------------------------------------------
COUNTRY
--------------------------------------------------
AGE                                                    SALARY
-------------------------------------------------- ----------
india
22                                                      20500


        ID NAME
---------- --------------------------------------------------
ADDRESS
--------------------------------------------------
CITY
--------------------------------------------------
COUNTRY
--------------------------------------------------
AGE                                                    SALARY
-------------------------------------------------- ----------
         5 lavanya
sandram
TVM

        ID NAME
---------- --------------------------------------------------
ADDRESS
--------------------------------------------------
CITY
--------------------------------------------------
COUNTRY
--------------------------------------------------
AGE                                                    SALARY
-------------------------------------------------- ----------
india
26                                                      35600


SQL> select * from customer where salary like '%50%';

        ID NAME
---------- --------------------------------------------------
ADDRESS
--------------------------------------------------
CITY
--------------------------------------------------
COUNTRY
--------------------------------------------------
AGE                                                    SALARY
-------------------------------------------------- ----------
         1 priya
red valley
texas

        ID NAME
---------- --------------------------------------------------
ADDRESS
--------------------------------------------------
CITY
--------------------------------------------------
COUNTRY
--------------------------------------------------
AGE                                                    SALARY
-------------------------------------------------- ----------
NW
29                                                      19500


        ID NAME
---------- --------------------------------------------------
ADDRESS
--------------------------------------------------
CITY
--------------------------------------------------
COUNTRY
--------------------------------------------------
AGE                                                    SALARY
-------------------------------------------------- ----------
         3 vikram desayi
desayi house
melvi

        ID NAME
---------- --------------------------------------------------
ADDRESS
--------------------------------------------------
CITY
--------------------------------------------------
COUNTRY
--------------------------------------------------
AGE                                                    SALARY
-------------------------------------------------- ----------
india
45                                                      17500


        ID NAME
---------- --------------------------------------------------
ADDRESS
--------------------------------------------------
CITY
--------------------------------------------------
COUNTRY
--------------------------------------------------
AGE                                                    SALARY
-------------------------------------------------- ----------
         4 sandra
v i bhavan
TVM

        ID NAME
---------- --------------------------------------------------
ADDRESS
--------------------------------------------------
CITY
--------------------------------------------------
COUNTRY
--------------------------------------------------
AGE                                                    SALARY
-------------------------------------------------- ----------
india
22                                                      20500


SQL> select * from customer where city like 'na_ik';

        ID NAME
---------- --------------------------------------------------
ADDRESS
--------------------------------------------------
CITY
--------------------------------------------------
COUNTRY
--------------------------------------------------
AGE                                                    SALARY
-------------------------------------------------- ----------
         2 devika
villa house
nalik

        ID NAME
---------- --------------------------------------------------
ADDRESS
--------------------------------------------------
CITY
--------------------------------------------------
COUNTRY
--------------------------------------------------
AGE                                                    SALARY
-------------------------------------------------- ----------
mexico
35                                                      17000


SQL> select * from customer where salary like '3__00';

        ID NAME
---------- --------------------------------------------------
ADDRESS
--------------------------------------------------
CITY
--------------------------------------------------
COUNTRY
--------------------------------------------------
AGE                                                    SALARY
-------------------------------------------------- ----------
         5 lavanya
sandram
TVM

        ID NAME
---------- --------------------------------------------------
ADDRESS
--------------------------------------------------
CITY
--------------------------------------------------
COUNTRY
--------------------------------------------------
AGE                                                    SALARY
-------------------------------------------------- ----------
india
26                                                      35600


SQL> select * from customer where name like '____a%';

        ID NAME
---------- --------------------------------------------------
ADDRESS
--------------------------------------------------
CITY
--------------------------------------------------
COUNTRY
--------------------------------------------------
AGE                                                    SALARY
-------------------------------------------------- ----------
         1 priya
red valley
texas

        ID NAME
---------- --------------------------------------------------
ADDRESS
--------------------------------------------------
CITY
--------------------------------------------------
COUNTRY
--------------------------------------------------
AGE                                                    SALARY
-------------------------------------------------- ----------
NW
29                                                      19500


        ID NAME
---------- --------------------------------------------------
ADDRESS
--------------------------------------------------
CITY
--------------------------------------------------
COUNTRY
--------------------------------------------------
AGE                                                    SALARY
-------------------------------------------------- ----------
         3 vikram desayi
desayi house
melvi

        ID NAME
---------- --------------------------------------------------
ADDRESS
--------------------------------------------------
CITY
--------------------------------------------------
COUNTRY
--------------------------------------------------
AGE                                                    SALARY
-------------------------------------------------- ----------
india
45                                                      17500


SQL> select * from customer where name not like 'priya';

        ID NAME
---------- --------------------------------------------------
ADDRESS
--------------------------------------------------
CITY
--------------------------------------------------
COUNTRY
--------------------------------------------------
AGE                                                    SALARY
-------------------------------------------------- ----------
         2 devika
villa house
nalik

        ID NAME
---------- --------------------------------------------------
ADDRESS
--------------------------------------------------
CITY
--------------------------------------------------
COUNTRY
--------------------------------------------------
AGE                                                    SALARY
-------------------------------------------------- ----------
mexico
35                                                      17000


        ID NAME
---------- --------------------------------------------------
ADDRESS
--------------------------------------------------
CITY
--------------------------------------------------
COUNTRY
--------------------------------------------------
AGE                                                    SALARY
-------------------------------------------------- ----------
         3 vikram desayi
desayi house
melvi

        ID NAME
---------- --------------------------------------------------
ADDRESS
--------------------------------------------------
CITY
--------------------------------------------------
COUNTRY
--------------------------------------------------
AGE                                                    SALARY
-------------------------------------------------- ----------
india
45                                                      17500


        ID NAME
---------- --------------------------------------------------
ADDRESS
--------------------------------------------------
CITY
--------------------------------------------------
COUNTRY
--------------------------------------------------
AGE                                                    SALARY
-------------------------------------------------- ----------
         4 sandra
v i bhavan
TVM

        ID NAME
---------- --------------------------------------------------
ADDRESS
--------------------------------------------------
CITY
--------------------------------------------------
COUNTRY
--------------------------------------------------
AGE                                                    SALARY
-------------------------------------------------- ----------
india
22                                                      20500


        ID NAME
---------- --------------------------------------------------
ADDRESS
--------------------------------------------------
CITY
--------------------------------------------------
COUNTRY
--------------------------------------------------
AGE                                                    SALARY
-------------------------------------------------- ----------
         5 lavanya
sandram
TVM

        ID NAME
---------- --------------------------------------------------
ADDRESS
--------------------------------------------------
CITY
--------------------------------------------------
COUNTRY
--------------------------------------------------
AGE                                                    SALARY
-------------------------------------------------- ----------
india
26                                                      35600


SQL> commit
  2  commit;
commit
*
ERROR at line 2:
ORA-02185: a token other than WORK follows COMMIT


SQL> commit;

Commit complete.

SQL>